article_id,source_name,title,event,bias,country,adfontes_bias,mentions_gw
125720,Phys.Org,Climate change is turning swaths of California's mountains into 'zombie forests',drought,pro-science,gb,Middle,True
134902,The Times of India,Climate change threatens to reverse health gains: World Meteorological Organization,drought,right-center,in,Middle,True
152983,ABC News,Californians bet farming agave for spirits holds key to weathering drought and groundwater limits,drought,left-center,us,Middle,True
167890,The Punch,"Lead campaign for green economy, Obasanjo tells youths",drought,left-center,ng,,True
167952,The Times of India,Invasive species could reap benefits from extreme weather,drought,right-center,in,Middle,True
180948,Business Insider,35 elephants suddenly dropped dead in 2020. Their case has finally been solved.,drought,left-center,us,Middle,True
200371,Phys.Org,"October obliterated temperature records, virtually guaranteeing 2023 will be hottest year on record",drought,pro-science,gb,Middle,True
200472,ABC News,"As price of olive oil soars, chainsaw-wielding thieves target Mediterranean's trees",drought,left-center,us,Middle,True
200483,Al Jazeera English,Dozens dead and thousands trapped in Somalia’s ‘worst floods in decades’,drought,left-center,us,Skews Left,True
200527,International Business Times,Hottest October Globally Marks Fifth Record-shattering Month,drought,left-center,us,Middle,True
200565,International Business Times,"Scientists Blame Climate Change For 'Extreme Drought' In Iraq, Iran And Syria",drought,left-center,us,Middle,True
200608,ABC News,"Nasty drought in Syria, Iraq and Iran wouldn't have happened without climate change, study finds",drought,left-center,us,Middle,True
200671,AllAfrica - Top Africa News,Meet the Two WFP-Backed Earthshot Prize Winners,drought,least biased,af,,True
212451,NPR,Virginia's governor declares a state of emergency over wildfires,drought,left-center,us,Middle,True
228092,The Times of India,"Worst floods in decades kill 29 in Somalia, hit towns across East Africa",drought,right-center,in,Middle,True
228973,BBC News,Somalia floods: UN warns of 'once-in-a-century event',drought,left-center,gb,Middle,True
242434,The Punch,"Your investments safe in Nigeria, Tinubu assures Saudi investors",drought,left-center,ng,,True
261686,Forbes,Climate Change Propels France To #1 Largest Global Wine Producer In 2023,drought,right-center,us,Middle,True
261780,ABC News,"How researchers, farmers and brewers want to safeguard beer against climate change",drought,left-center,us,Middle,True
261786,ABC News,Mexico City imposes another round of water restrictions in the face of drought 'crisis',drought,left-center,us,Middle,True
266825,BBC News,Earthshot Prize: Asia leads the way in quest to repair planet,drought,left-center,gb,Middle,True
271255,Phys.Org,Farmers or foragers? Pre-colonial Aboriginal food production was hardly that simple,drought,pro-science,gb,Middle,True
272022,The Times of India,Mexico imposes severe water restrictions as drought dries up reservoirs,drought,right-center,in,Middle,True
284599,Phys.Org,"How researchers, farmers and brewers want to safeguard beer against climate change",drought,pro-science,gb,Middle,True
286867,ABC News,There's another wildfire burning in Hawaii. This one is destroying irreplaceable rainforest on Oahu,drought,left-center,us,Middle,True
82631,Phys.Org,The Rio Grande isn't just a border—it's a river in crisis,drought,pro-science,gb,Middle,True
85089,Forbes,"43M Children Displaced By Floods, Storms, Droughts, Wildfires Since 2016",drought,right-center,us,Middle,True
85470,CNN,This Moroccan startup is growing crops in the desert,drought,left-center,us,Skews Left,True
327375,NPR,The UN's Guterres calls for an 'ambition supernova' as climate progress stays slow,drought,left-center,us,Middle,True
327386,ABC News,Why climate change is worsening in every part of the US: Report,drought,left-center,us,Middle,True
327483,Time,"Climate Change is Hitting Every Part of Americans’ Daily Lives, Major Report Warns",drought,left-center,us,Skews Left,True
327527,Globalsecurity.org,"World News in Brief: Water crisis for children, hunger in East Africa, new Yazidi memorial",drought,least biased,us,,True
327567,The Verge,Latest US climate assessment shows the extreme toll taken by climate change,drought,left-center,us,Middle,True
340748,NPR,How do you help people escape climate change disaster? Here's a novel solution,drought,left-center,us,Middle,True
340998,The Times of India,"How much can trees fight climate change? Massively, but not alone, study finds",drought,right-center,in,Middle,True
342003,Phys.Org,Researcher: This is the hottest autumn on record—and it's impacting the climate system and human society,drought,pro-science,gb,Middle,True
360552,Globalsecurity.org,From drought to floods: climate extremes drive Somalia hunger crisis,drought,least biased,us,,True
360638,ABC News,"Asian economies must ramp up wind and solar power to keep global warming under 1.5C, report says",drought,left-center,us,Middle,True
360683,AllAfrica - Top Africa News,Somalia: From Drought to Floods - Climate Extremes Drive Somalia Hunger Crisis,drought,least biased,af,,True
363375,International Business Times,Heat Projected To Kill Nearly Five Times More People By 2050,drought,left-center,us,Middle,True
371955,ABC News,Heat-related deaths for older adults could increase by 370% through mid-century if climate warms 2 degrees Celsius,drought,left-center,us,Middle,True
387037,Phys.Org,Flash floods kill 100 in Horn of Africa: charity,drought,pro-science,gb,Middle,True
387573,ABC News,Pastoralists have raised livestock in harsh climates for millennia. What can they teach us today?,drought,left-center,us,Middle,True
387587,ABC News,Pastoralists have raised livestock in harsh climates for millennia. What can they teach us today?,drought,left-center,us,Middle,True
387695,Phys.Org,Pastoralists have raised livestock in harsh climates for millennia. What can they teach us today?,drought,pro-science,gb,Middle,True
392846,ABC News,AP PHOTOS: Mongolia's herders fight climate change with their own adaptability and new technology,drought,left-center,us,Middle,True
394846,ABC News,Climate change is hastening the demise of Pacific Northwest forests,drought,left-center,us,Middle,True
400907,Phys.Org,Climate change is hastening the demise of Pacific Northwest forests,drought,pro-science,gb,Middle,True
417185,Phys.Org,Report: Climate change impacts on water are profound and unequal,drought,pro-science,gb,Middle,True
420733,ABC News,'Once-in-a century’ floods erode resilience of Somalia's displaced,drought,left-center,us,Middle,True
435884,The Times of India,Kenya's economy faces climate change risks: World Bank,drought,right-center,in,Middle,True
434761,The Punch,"Food sufficiency: Hope rises as Nigeria, Africa leverage genome editing",drought,left-center,ng,,True
435711,The Punch,FG seeks states involvement in climate change issues,drought,left-center,ng,,True
457291,Globalsecurity.org,Severe floods affect tens of thousands of displaced people in Horn of Africa,drought,least biased,us,,True
470013,Phys.Org,Threat from sand and dust storms spreading: UN,drought,pro-science,gb,Middle,True
481069,ABC News,Extreme weather can hit farmers hard. Those with smaller farming operations often pay the price,drought,left-center,us,Middle,True
536056,CNN,"The world is making, and drinking, less wine. Winemakers are struggling",drought,left-center,us,Skews Left,True
87447,Forbes,How The Israel-Hamas War And Global Conflict Hinder Climate Action,drought,right-center,us,Middle,True
87545,The Punch,Climate challenges fueling insecurity in Nigeria — Niger gov,drought,left-center,ng,,True
89235,CNN,Nobel Peace Prize could give a glimmer of hope amid era of conflict and climate crisis,drought,left-center,us,Skews Left,True
89448,Forbes,Floods In Libya And India Highlight Rising Risk To Dams,drought,right-center,us,Middle,True
516783,The Punch,"Floods displaced 650,000 Nigerian children in six years – UNICEF",drought,left-center,ng,,True
558563,The Times of India,India's farmers wrestle with shift to eco-friendly agriculture,drought,right-center,in,Middle,True
584062,The Punch,Somalia flood death toll hits 50,drought,left-center,ng,,True
584102,The Indian Express,"Not just sanitation, but climate-proof sanitation",drought,left-center,in,Middle,True
606752,ABC News,"Precious water: As more of the world thirsts, luxury water becoming fashionable among the elite",drought,left-center,us,Middle,True
619680,BBC News,Climate change: Rise in Google searches around ‘anxiety’,drought,left-center,gb,Middle,True
639571,Al Jazeera English,"First the drought, then flood: Climate crisis compounds woes for Somalis",drought,left-center,us,Skews Left,True
654305,Forbes,"Gobble, Gobble, Gone? How Climate Impacts Could One Day Mean Turkey-Free Thanksgiving",drought,right-center,us,Middle,True
666909,BBC News,Ethiopia drought: Fifty die of hunger in Tigray and Amhara amid aid freeze,drought,left-center,gb,Middle,True
668088,Phys.Org,"The flat Fens of eastern England once held vast woodlands, study finds",drought,pro-science,gb,Middle,True
672986,GlobeNewswire,Battling Water Scarcity: The Growing Significance of Seawater and Brackish Water Desalination,drought,least biased,us,,True
703310,Phys.Org,Climate adaptation funds are not reaching front-line communities: What needs to be done about it,drought,pro-science,gb,Middle,True
731169,The Times of India,How did humans get to the brink of crashing climate? A long push for progress and energy to fuel it,drought,right-center,in,Middle,True
731798,International Business Times,Disease Stalks Somali District Ravaged By Floods,drought,left-center,us,Middle,True
740205,ABC News,How did humans get to the brink of crashing climate? A long push for progress and energy to fuel it,drought,left-center,us,Middle,True
91048,BBC News,El Nino drought: Panama Canal cuts ship numbers further,drought,left-center,gb,Middle,False
91176,Forbes,Enlist New Nuclear Reactor Tech And DHS FEMA To Project Power Ashore,drought,right-center,us,Middle,False
91188,Forbes,Six Trends For Shipping And Logistics Globally In 2024 And Beyond,drought,right-center,us,Middle,False
93287,Phys.Org,Report: The US just had its seventh-warmest September on record,drought,pro-science,gb,Middle,False
93746,Marketscreener.com,NS United Kaiun Kaisha : Supplementary Material for the 2nd Quarter of the FY ending March 2024,drought,least biased,fr,,False
95461,Phys.Org,Mayotte turns to bottled water in century's worst drought,drought,pro-science,gb,Middle,False
96441,Phys.Org,Reports says Nevada is virtually drought-free,drought,pro-science,gb,Middle,False
100914,Phys.Org,Research finds sustainable dairy farms also performed better economically,drought,pro-science,gb,Middle,False
110898,The Punch,Fulham vs Manchester United Predictions: Manchester to make it a hat-trick of away wins,drought,left-center,ng,,False
15645,Phys.Org,Study shows live plant pathogens can travel on dust across oceans,drought,pro-science,gb,Middle,False
16133,BBC News,Zimbabwe Elephant deaths: Mysterious bacterium found in bodies,drought,left-center,gb,Middle,False
19832,ABC News,"7 dead, 25 injured in 'super fog' multi-car pileup on Louisiana highway: Police",drought,left-center,us,Middle,False
19834,BBC News,Seven dead after 'super fog' kills seven in New Orleans crash,drought,left-center,gb,Middle,False
19923,Phys.Org,Scientists gain powerful tool to scrutinize changing US weather patterns,drought,pro-science,gb,Middle,False
20110,ABC News,"'Miracle' water year in California: Rain, snow put reservoirs at 128% of average",drought,left-center,us,Middle,False
21450,Business Insider,"A drought in the Amazon uncovered ancient, eerie face carvings that look like emojis",drought,left-center,us,Middle,False
21530,NPR,More than 100 dolphins found dead in Brazilian Amazon as water temperatures soar,drought,left-center,us,Middle,False
46796,International Business Times,Grapes Of Wrath: Albania Winemakers Struggle With Warmer World,drought,left-center,us,Middle,False
54027,Phys.Org,Deforestation down in Brazil's Amazon,drought,pro-science,gb,Middle,False
63645,BBC News,Ethiopian scientist Gebisa Ejeta receives National Medal of Science from US,drought,left-center,gb,Middle,False
68331,Phys.Org,Ancient Maya reservoirs offer lessons for today's water crises,drought,pro-science,gb,Middle,False
71572,CNA,"Indonesia president says rupiah's drop still 'safe', flags tax incentives",drought,least biased,sg,Middle,False
73663,The Punch,Orban no longer MVP in Belgium,drought,left-center,ng,,False
135096,Phys.Org,"Storms kill three, displace thousands in southern South America",drought,pro-science,gb,Middle,False
137763,Globalsecurity.org,"5,000 Myanmar nationals flee into China, face shortages",drought,least biased,us,,False
153364,The Times of India,CM seeks drought report from dist mins on Nov 15,drought,right-center,in,Middle,False
154174,The Punch,"Rangers, Heartland clash in Oriental derby",drought,left-center,ng,,False
158246,The Times of India,"Tank to Tractor: Pakistan Army transforms into 'farmers', becomes largest landowner amid food crisis",drought,right-center,in,Middle,False
229053,Forbes,18M Properties And $8T At Extreme Risk And How It’s Changing Housing,drought,right-center,us,Middle,False
229084,Globalsecurity.org,"As Somalia faces once-in-a-century flooding, UN relief wing releases $25 million to jumpstart life-saving assistance",drought,least biased,us,,False
255220,The Times of India,Once-in-a-century flooding swamps Somalia after historic drought: UN,drought,right-center,in,Middle,False
255813,The Punch,NLNG blames high cooking gas prices on forex,drought,left-center,ng,,False
268238,Business Insider,This is the world's next major election. The winner has to fix chronic hyperinflation and halt a 6th recession in 10 years.,drought,left-center,us,Middle,False
289577,The Times of India,India will have to wait for another three World Cups if they don't win it this time: Shastri,drought,right-center,in,Middle,False
296097,Al Jazeera English,‘A metaphor for life’: Bollywood’s stormy love affair with Indian cricket,drought,left-center,us,Skews Left,False
306239,The Punch,Sesame Seeds: A Complete Guide Of How To Export And Supply From Nigeria With Zaph And Zoe Agro Export Company,drought,left-center,ng,,False
307319,Phys.Org,Researchers reveal evolutionary secret underlying the rise of seed plants,drought,pro-science,gb,Middle,False
84192,The Punch,"114m people displaced by war, violence worldwide -UN",drought,left-center,ng,,False
390323,BBC News,Somalia floods: Bodies unearthed and bridges swept away,drought,left-center,gb,Middle,False
459183,The Punch,Awoniyi out of Zimbabwe clash,drought,left-center,ng,,False
459277,The Punch,"Ronaldo United’s best, Messi greatest ever – Bola BMH",drought,left-center,ng,,False
457296,Globalsecurity.org,Displaced families uprooted by severe floods across Horn of Africa,drought,least biased,us,,False
469471,The Indian Express,How drought gave birth to this Maharashtra startup that simplified farming for onion growers,drought,left-center,in,Middle,False
517267,Al Jazeera English,‘Out of control’ fires endanger wildlife in Brazil’s Pantanal wetlands,drought,left-center,us,Skews Left,False
524258,The Times of India,"Karnataka to consider parking govt funds in Co-Op banks, says CM Siddaramaiah",drought,right-center,in,Middle,False
531091,The Times of India,Why many supermarkets are putting olive oil bottles under lock and key,drought,right-center,in,Middle,False
596127,The Times of India,Water shortage in eastern Rajasthan districts brings ERCP into focus this election,drought,right-center,in,Middle,False
606948,Phys.Org,"The good, bad and essential: Microbes that affect food and health",drought,pro-science,gb,Middle,False
618661,Phys.Org,Unveiling the subtle influence of rootstocks on grapevine growth and wine quality: A 30-year X-ray imaging study,drought,pro-science,gb,Middle,False
671241,The Times of India,Asian Development Bank unleashes $170 million wave to transform Kochi's water landscape,drought,right-center,in,Middle,False
674373,The Times of India,"FM dials ITC, asks to buy millets from Karnataka’s drought-hit farmers",drought,right-center,in,Middle,False
674459,The Times of India,"FM dials ITC, asks to buy millets from Karnataka’s drought-hit farmers",drought,right-center,in,Middle,False
677650,The Times of India,Adb unleashes USD 170 mn wave to transform Kochi's water landscape,drought,right-center,in,Middle,False
776019,The Punch,"10 years after, power play grounds Kano’s multi-billion naira electricity project",drought,left-center,ng,,False
92933,Phys.Org,Japan sees hottest September since records began,heatwave,pro-science,gb,Middle,True
95498,Phys.Org,UN sounds warning on climate change health threat,heatwave,pro-science,gb,Middle,True
96430,Phys.Org,Here are the places that could become too hot for humans due to climate change,heatwave,pro-science,gb,Middle,True
613,Phys.Org,Climate change main culprit for hot South American winter,heatwave,pro-science,gb,Middle,True
9831,CNN,The climate crisis is coming for your hoppy beer,heatwave,left-center,us,Skews Left,True
15209,Phys.Org,Climate-driven extreme heat may make parts of Earth too hot for humans,heatwave,pro-science,gb,Middle,True
16536,BBC News,World breaches key 1.5C warming mark for record number of days,heatwave,left-center,gb,Middle,True
20024,Phys.Org,Life on Earth under 'existential threat': climate scientists,heatwave,pro-science,gb,Middle,True
20027,Phys.Org,New map shows how climate change affects your community and its vulnerability to weather,heatwave,pro-science,gb,Middle,True
20043,Phys.Org,Eastern Canada breaks autumn heat records,heatwave,pro-science,gb,Middle,True
20099,Phys.Org,Global study warns water security threatened by droughts and heat waves worldwide,heatwave,pro-science,gb,Middle,True
20105,NPR,The military is turning to microgrids to fight global threats — and global warming,heatwave,left-center,us,Middle,True
20107,Forbes,Extreme Weather Disrupts U.S. Oil And Gas Sector,heatwave,right-center,us,Middle,True
20926,Business Insider,The verdict is in on how much Texas' heat wave clobbered its economy this summer,heatwave,left-center,us,Middle,True
26924,Phys.Org,Could 'marine cloud brightening' reduce coral bleaching on the Great Barrier Reef?,heatwave,pro-science,gb,Middle,True
32215,Phys.Org,Designing marine protected areas in the fight against climate change,heatwave,pro-science,gb,Middle,True
48226,Phys.Org,Virtually certain 2023 will be warmest year on record: US agency,heatwave,pro-science,gb,Middle,True
48352,International Business Times,Virtually Certain 2023 Will Be Warmest Year On Record: US Agency,heatwave,left-center,us,Middle,True
48362,CNA,Life on Earth under 'existential threat': Climate scientists,heatwave,least biased,sg,Middle,True
48366,NPR,"It's the warmest September on record thanks to El Niño and, yes, climate change",heatwave,left-center,us,Middle,True
48389,CNA,Virtually certain 2023 will be warmest year on record: US agency,heatwave,least biased,sg,Middle,True
48463,International Business Times,Life On Earth Under 'Existential Threat': Climate Scientists,heatwave,left-center,us,Middle,True
55204,Phys.Org,"Earth's vital signs are now in 'uncharted territory,' climate scientists warn",heatwave,pro-science,gb,Middle,True
78176,Phys.Org,Record heat unleashes deadly floods from New York to Libya,heatwave,pro-science,gb,Middle,True
78680,CNN,2023 on track to be the hottest year as September shatters heat records,heatwave,left-center,us,Skews Left,True
78761,International Business Times,September Was Hottest On Record By 'Extraordinary' Margin: EU Monitor,heatwave,left-center,us,Middle,True
134902,The Times of India,Climate change threatens to reverse health gains: World Meteorological Organization,heatwave,right-center,in,Middle,True
135450,Globalsecurity.org,UN: Asia bears brunt as climate change threatens health gains,heatwave,least biased,us,,True
167952,The Times of India,Invasive species could reap benefits from extreme weather,heatwave,right-center,in,Middle,True
212246,BBC News,Polluters face 20 years in jail under Scottish ecocide plan,heatwave,left-center,gb,Middle,True
200516,RT,This year ‘virtually certain’ to be warmest on record – EU scientists,heatwave,right-center,ru,Skews Right,True
199978,BBC News,'Virtually certain' that 2023 will be warmest year after October record,heatwave,left-center,gb,Middle,True
200371,Phys.Org,"October obliterated temperature records, virtually guaranteeing 2023 will be hottest year on record",heatwave,pro-science,gb,Middle,True
200527,International Business Times,Hottest October Globally Marks Fifth Record-shattering Month,heatwave,left-center,us,Middle,True
200574,ABC News,"October obliterated temperature records, virtually guaranteeing 2023 will be hottest year on record",heatwave,left-center,us,Middle,True
200711,The Times of India,"This year 'virtually certain' to be warmest in 125,000 years, EU scientists say",heatwave,right-center,in,Middle,True
200716,The Times of India,"This year 'virtually certain' to be warmest in 125,000 years, EU scientists say",heatwave,right-center,in,Middle,True
212420,The Times of India,"'This year 'virtually certain' to be warmest in 125,000 years'",heatwave,right-center,in,Middle,True
212452,The Times of India,"This year 'virtually certain' to be warmest in 125,000 years, EU scientists say",heatwave,right-center,in,Middle,True
225794,Time,Hottest October On Record Makes It Almost Certain 2023 Will Be Hottest Year Ever,heatwave,left-center,us,Skews Left,True
81717,BBC News,Malawi heatwave warning issued as temperatures set to soar,heatwave,left-center,gb,Middle,True
327379,NPR,"Climate change affects your life in 3 big ways, a new report warns",heatwave,left-center,us,Middle,True
327386,ABC News,Why climate change is worsening in every part of the US: Report,heatwave,left-center,us,Middle,True
327483,Time,"Climate Change is Hitting Every Part of Americans’ Daily Lives, Major Report Warns",heatwave,left-center,us,Skews Left,True
327567,The Verge,Latest US climate assessment shows the extreme toll taken by climate change,heatwave,left-center,us,Middle,True
334499,Phys.Org,New study highlights need to address risk of continued global warming after net zero,heatwave,pro-science,gb,Middle,True
359971,BBC News,Brazil: Health warnings as country gripped by 'unbearable' heatwave,heatwave,left-center,gb,Middle,True
360317,Phys.Org,Heat projected to kill nearly five times more people by 2050,heatwave,pro-science,gb,Middle,True
363340,Phys.Org,"Georgia, Southeast among the most at-risk from climate change, report finds",heatwave,pro-science,gb,Middle,True
363375,International Business Times,Heat Projected To Kill Nearly Five Times More People By 2050,heatwave,left-center,us,Middle,True
371826,The Times of India,"Yearly heat-related deaths to see fivefold rise by mid-century, climate inaction threatening public health: Lancet report",heatwave,right-center,in,Middle,True
371955,ABC News,Heat-related deaths for older adults could increase by 370% through mid-century if climate warms 2 degrees Celsius,heatwave,left-center,us,Middle,True
384529,Phys.Org,"Climate engineering could slow Antarctic ice loss, study says",heatwave,pro-science,gb,Middle,True
387589,The Times of India,View: The last thing the game of cricket needs is Saudi money,heatwave,right-center,in,Middle,True
387675,Phys.Org,Study shows temperature variability reduces songbird nesting success,heatwave,pro-science,gb,Middle,True
465963,The Times of India,2023 most likely the warmest year on record: WMO,heatwave,right-center,in,Middle,True
420817,Business Insider,The key to fighting the urban doom loop might be a downtown beach,heatwave,left-center,us,Middle,True
481143,The Times of India,Climate crisis potentially lethal threat for people with mental health problems: Report,heatwave,right-center,in,Middle,True
472626,Forbes,How Can AI Help Prevent WildFires Due To Climatic Change?,heatwave,right-center,us,Middle,True
480775,Business Insider,Florida scientists are giving coral IVF treatments to help bolster dying reef,heatwave,left-center,us,Middle,True
516505,Phys.Org,Global one-day temperature spikes above 2C for first time: EU monitor,heatwave,pro-science,gb,Middle,True
516627,International Business Times,Global One-day Temperature Spikes Above 2C For First Time: EU Monitor,heatwave,left-center,us,Middle,True
583970,BBC News,Brazil records its hottest ever temperature,heatwave,left-center,gb,Middle,True
584076,NPR,A fan died of heat at a Taylor Swift concert. It's a rising risk with climate change,heatwave,left-center,us,Middle,True
650869,Phys.Org,Northern bees at risk from insecticide,heatwave,pro-science,gb,Middle,True
689593,International Business Times,"Heat, Disease, Air Pollution: How Climate Change Impacts Health",heatwave,left-center,us,Middle,True
689750,The Times of India,UN Climate talks embrace first-ever 'Health Day' amidst urgent calls to tackle global warming's health impact,heatwave,right-center,in,Middle,True
708642,International Business Times,"COP28 Host UAE Ready For Rising Heat Risk, Says Minister",heatwave,left-center,us,Middle,True
754710,NPR,3 climate impacts the U.S. will see if warming goes beyond 1.5 degrees,heatwave,left-center,us,Middle,True
93287,Phys.Org,Report: The US just had its seventh-warmest September on record,heatwave,pro-science,gb,Middle,False
95525,Phys.Org,A monster eddy current is spinning into existence off the coast of Sydney—will it bring a new marine heat wave?,heatwave,pro-science,gb,Middle,False
6937,CNA,Mandatory hourly breaks for some outdoor workers when weather gets too hot: MOM,heatwave,least biased,sg,Middle,False
