article_id,source_name,title,event,bias,country,adfontes_bias,mentions_gw
89887,Al Jazeera English,Minor parties could hold key to New Zealand election,cyclone,left-center,us,Skews Left,True
91835,Time,Millions of Children Displaced Due To Extreme Weather. Climate Change Will Make It Worse,cyclone,left-center,us,Skews Left,True
91978,Al Jazeera English,Hong Kong drenched and battered by weakening Typhoon Koinu,cyclone,left-center,us,Skews Left,True
91985,Phys.Org,Millions of children are displaced due to extreme weather events. Climate change will make it worse,cyclone,pro-science,gb,Middle,True
92027,Phys.Org,"Typhoon Koinu skirts Hong Kong, heads for southern China's Hainan island",cyclone,pro-science,gb,Middle,True
92101,Euronews,"Millions of children displaced due to extreme weather events, says UNICEF",cyclone,left-center,eu,Middle,True
92439,CNN,"Floods, storms and fires displaced 20,000 children every day over past six years, UNICEF report finds",cyclone,left-center,us,Skews Left,True
92518,Globalsecurity.org,UN: Millions of children in Asia displaced by weather-related events,cyclone,least biased,us,,True
92646,Phys.Org,"If we protect mangroves, we protect our fisheries, our towns and ourselves",cyclone,pro-science,gb,Middle,True
92974,Phys.Org,Deadly Storm Babet batters Scotland and Scandinavia,cyclone,pro-science,gb,Middle,True
93348,NPR,Have an heirloom ruined by climate disaster? There's a hotline to call for help,cyclone,left-center,us,Middle,True
93424,Business Insider,America's cities are vying for a hot new title: best place to ride out the coming dystopia,cyclone,left-center,us,Middle,True
94262,BBC News,Storm Ciarán: Flooding and damage hits homes across UK,cyclone,left-center,gb,Middle,True
95674,Forbes,Voluntary Carbon Market Scrutiny: Raising Ambition Or Killing It?,cyclone,right-center,us,Middle,True
96879,The Times of India,"Rail services cancelled, several schools closed as storm Ciaran triggers weather alert in northwestern Europe",cyclone,right-center,in,Middle,True
98964,Marketscreener.com,Quanta Services : Outlook Expectations Summary Q3 2023,cyclone,least biased,fr,,True
103823,Phys.Org,Seven dead as Western Europe hit by record winds of Storm Ciaran,cyclone,pro-science,gb,Middle,True
8341,ABC News,Millions of children are displaced due to extreme weather events. Climate change will make it worse,cyclone,left-center,us,Middle,True
8372,The Times of India,"Over 43 million kids displaced by floods, storms, droughts, wildfires between 2016-2021",cyclone,right-center,in,Middle,True
11027,The Indian Express,"UPSC Essentials | Weekly news express — Global Hunger Index, Periodic Labour Force Survey, and more: Key takeaways and Points to ponder",cyclone,left-center,in,Middle,True
11981,International Business Times,"Typhoon Koinu Skirts Hong Kong, Heads For Southern China's Hainan Island",cyclone,left-center,us,Middle,True
11984,International Business Times,"Hong Kong Halts Trading, Closes Schools Post-typhoon",cyclone,left-center,us,Middle,True
13640,Phys.Org,"Federal forecasters predict warm, wet US winter but less snow because of El Nino, climate change",cyclone,pro-science,gb,Middle,True
13672,Phys.Org,Toxic storms blamed on climate change cloud Tajikistan,cyclone,pro-science,gb,Middle,True
18343,Phys.Org,Storm Ciaran triggers weather alert in northwestern Europe,cyclone,pro-science,gb,Middle,True
19750,Gizmodo.com,Here's Where NYC Is Sinking,cyclone,left,us,Skews Left,True
19919,Phys.Org,"Rider on the storm: Shearwater seabird catches an 11-hour ride over 1,000 kilometers in a typhoon",cyclone,pro-science,gb,Middle,True
20003,Phys.Org,Study investigates impact of extreme weather events on ocean circulation in tropical Pacific,cyclone,pro-science,gb,Middle,True
20105,NPR,The military is turning to microgrids to fight global threats — and global warming,cyclone,left-center,us,Middle,True
20107,Forbes,Extreme Weather Disrupts U.S. Oil And Gas Sector,cyclone,right-center,us,Middle,True
23564,NPR,Up First newsletter: Maine shooter at large; support for humanitarian pause in Gaza,cyclone,left-center,us,Middle,True
29021,NPR,Feeling the pinch of high home insurance rates? It's not getting better anytime soon,cyclone,left-center,us,Middle,True
31884,NPR,"It's unlikely, but not impossible, to limit global warming to 1.5 Celsius, study finds",cyclone,left-center,us,Middle,True
31995,Time,"Go Midwest, Young Man",cyclone,left-center,us,Skews Left,True
32131,Phys.Org,Thunderstorms clumping together: How understanding water vapor helps scientists predict future climate change,cyclone,pro-science,gb,Middle,True
32157,Phys.Org,World can't 'unplug' existing energy system: COP28 head,cyclone,pro-science,gb,Middle,True
32204,Phys.Org,Why climate change is a national security risk,cyclone,pro-science,gb,Middle,True
32220,Phys.Org,"'Spatial sorting' dominated bug evolution after Hurricane Harvey flooding, study shows",cyclone,pro-science,gb,Middle,True
43786,Phys.Org,How ready is your town? Researchers help coastal towns prepare for the next storm in a changing climate,cyclone,pro-science,gb,Middle,True
66290,BBC News,Storm Ciarán: England prepares for further disruption,cyclone,left-center,gb,Middle,True
48226,Phys.Org,Virtually certain 2023 will be warmest year on record: US agency,cyclone,pro-science,gb,Middle,True
48319,ABC News,Factory fishing in Antarctica for krill targets the cornerstone of a fragile ecosystem,cyclone,left-center,us,Middle,True
48352,International Business Times,Virtually Certain 2023 Will Be Warmest Year On Record: US Agency,cyclone,left-center,us,Middle,True
48389,CNA,Virtually certain 2023 will be warmest year on record: US agency,cyclone,least biased,sg,Middle,True
48821,Phys.Org,Likelihood of hail in Australia has changed substantially over the last four decades,cyclone,pro-science,gb,Middle,True
53446,NPR,Hurricane Otis rapidly strengthens off Mexico's Pacific coast as it nears Acapulco,cyclone,left-center,us,Middle,True
67767,International Business Times,'Zero Income' After Storms Ravage Famed Greek Apple Harvest,cyclone,left-center,us,Middle,True
69504,Phys.Org,"Taiwan cancels flights, shuts schools ahead of typhoon",cyclone,pro-science,gb,Middle,True
75167,Phys.Org,Q&A: Scientist helps fish harvesters implement adaptive strategies to climate change,cyclone,pro-science,gb,Middle,True
78176,Phys.Org,Record heat unleashes deadly floods from New York to Libya,cyclone,pro-science,gb,Middle,True
116247,BBC News,Storm Ciarán eases but flood warnings remain,cyclone,left-center,gb,Middle,True
121955,ABC News,"Storm Ciarán sweeps into Italy with record rainfall, killing 3 and bringing toll to 10",cyclone,left-center,us,Middle,True
132441,Phys.Org,Storm Ciarán is breaking records and research suggests more severe weather in future,cyclone,pro-science,gb,Middle,True
134902,The Times of India,Climate change threatens to reverse health gains: World Meteorological Organization,cyclone,right-center,in,Middle,True
134992,Al Jazeera English,"At least six dead in Italy as heavy rain, high winds sweep Europe",cyclone,left-center,us,Skews Left,True
135601,Globalsecurity.org,3 November 2023 - Daily Press Briefing by the Office of the Spokesperson for the Secretary-General,cyclone,least biased,us,,True
138097,Al Jazeera English,"Acapulco residents struggle to access food, medicine after Hurricane Otis",cyclone,left-center,us,Skews Left,True
140909,The Times of India,Sixteen dead as Storm Ciaran batters Western Europe,cyclone,right-center,in,Middle,True
156506,ABC News,"Some houses are being built to stand up to hurricanes and sharply cut emissions, too",cyclone,left-center,us,Middle,True
167979,GlobeNewswire,Unitil Reports Third Quarter Earnings,cyclone,least biased,us,,True
168095,GlobeNewswire,Great Lakes Reports Third Quarter 2023 Results,cyclone,least biased,us,,True
171348,Forbes,These Young Geniuses’ Innovation Can Help Save The World,cyclone,right-center,us,Middle,True
177172,CNN,Climate change is impacting the home insurance industry and damaging the housing market,cyclone,left-center,us,Skews Left,True
197556,Phys.Org,How global warming shakes the Earth: Seismic data show ocean waves gaining strength as the planet warms,cyclone,pro-science,gb,Middle,True
200371,Phys.Org,"October obliterated temperature records, virtually guaranteeing 2023 will be hottest year on record",cyclone,pro-science,gb,Middle,True
200527,International Business Times,Hottest October Globally Marks Fifth Record-shattering Month,cyclone,left-center,us,Middle,True
228980,Forbes,What Does Climate Preparedness Look Like?,cyclone,right-center,us,Middle,True
229041,Forbes,The Mystery Of The Missing $100 Billion Integral To COP28 Agenda,cyclone,right-center,us,Middle,True
286684,NPR,A tiny deer and rising seas: How far should people go to save an endangered species?,cyclone,left-center,us,Middle,True
293651,The Times of India,Storm Debi: Weather warnings are in force across the UK,cyclone,right-center,in,Middle,True
307011,Phys.Org,"Desperate for water, a desert city hopes to build a pipeline to the California Aqueduct",cyclone,pro-science,gb,Middle,True
81717,BBC News,Malawi heatwave warning issued as temperatures set to soar,cyclone,left-center,gb,Middle,True
82504,BBC News,'Extremely dangerous' Hurricane Lidia heads towards Mexico's Pacific coast,cyclone,left-center,gb,Middle,True
82573,ABC News,Eye of Hurricane Otis makes landfall near Mexico's Acapulco as Category 5 storm,cyclone,left-center,us,Middle,True
82599,Phys.Org,'Extremely dangerous' Hurricane Lidia heads for Mexico,cyclone,pro-science,gb,Middle,True
82613,Phys.Org,"Headed for Mexico, Hurricane Norma strengthens to Category 4",cyclone,pro-science,gb,Middle,True
82616,Phys.Org,'Potentially catastrophic' Hurricane Otis hits Mexico,cyclone,pro-science,gb,Middle,True
82640,Phys.Org,Hurricane Otis weakens after making landfall in Mexico,cyclone,pro-science,gb,Middle,True
82642,Phys.Org,Why did Hurricane Otis 'explosively' intensify off Mexico?,cyclone,pro-science,gb,Middle,True
82714,Phys.Org,"Lidia leaves at least one dead in Mexico, weakens to storm",cyclone,pro-science,gb,Middle,True
82750,Phys.Org,Turbocharged Otis caught forecasters and Mexico off-guard. Scientists aren't sure why,cyclone,pro-science,gb,Middle,True
82802,Phys.Org,"Extreme weather is outpacing even the worst-case scenarios of our forecasting models, says researcher",cyclone,pro-science,gb,Middle,True
82883,Phys.Org,"Hurricane causes 27 deaths, severe damage in Mexico's Acapulco",cyclone,pro-science,gb,Middle,True
85089,Forbes,"43M Children Displaced By Floods, Storms, Droughts, Wildfires Since 2016",cyclone,right-center,us,Middle,True
327375,NPR,The UN's Guterres calls for an 'ambition supernova' as climate progress stays slow,cyclone,left-center,us,Middle,True
327377,BBC News,AI could predict hurricane landfall sooner - report,cyclone,left-center,gb,Middle,True
327379,NPR,"Climate change affects your life in 3 big ways, a new report warns",cyclone,left-center,us,Middle,True
327386,ABC News,Why climate change is worsening in every part of the US: Report,cyclone,left-center,us,Middle,True
327441,BBC News,Coal tips in Wales: New maps reveal 350 sites most at risk,cyclone,left-center,gb,Middle,True
342003,Phys.Org,Researcher: This is the hottest autumn on record—and it's impacting the climate system and human society,cyclone,pro-science,gb,Middle,True
363340,Phys.Org,"Georgia, Southeast among the most at-risk from climate change, report finds",cyclone,pro-science,gb,Middle,True
363375,International Business Times,Heat Projected To Kill Nearly Five Times More People By 2050,cyclone,left-center,us,Middle,True
370601,BBC News,England's flood defence plans reduced 'due to inflation',cyclone,left-center,gb,Middle,True
371955,ABC News,Heat-related deaths for older adults could increase by 370% through mid-century if climate warms 2 degrees Celsius,cyclone,left-center,us,Middle,True
387589,The Times of India,View: The last thing the game of cricket needs is Saudi money,cyclone,right-center,in,Middle,True
387695,Phys.Org,Pastoralists have raised livestock in harsh climates for millennia. What can they teach us today?,cyclone,pro-science,gb,Middle,True
420799,Phys.Org,Let coastlines be coastlines: How nature-based approaches can protect Canada's coasts,cyclone,pro-science,gb,Middle,True
421143,Phys.Org,Study highlights need for enhanced tropical cyclone identification and simulation in climate models,cyclone,pro-science,gb,Middle,True
420817,Business Insider,The key to fighting the urban doom loop might be a downtown beach,cyclone,left-center,us,Middle,True
470013,Phys.Org,Threat from sand and dust storms spreading: UN,cyclone,pro-science,gb,Middle,True
474097,NPR,"A disappearing island: 'The water is destroying us, one house at a time'",cyclone,left-center,us,Middle,True
490982,The Times of India,"Two killed as stormy winds lash Bulgaria, Romania",cyclone,right-center,in,Middle,True
87189,Wired,Hydro Dams Are Struggling to Handle the World’s Intensifying Weather,cyclone,left-center,us,Skews Left,True
89293,Phys.Org,Factory fishing in Antarctica for krill targets the cornerstone of a fragile ecosystem,cyclone,pro-science,gb,Middle,True
511594,Phys.Org,Women are leading the fight to stop climate change,cyclone,pro-science,gb,Middle,True
513698,Al Jazeera English,Torrential rains kill at least 21 in Dominican Republic,cyclone,left-center,us,Skews Left,True
516505,Phys.Org,Global one-day temperature spikes above 2C for first time: EU monitor,cyclone,pro-science,gb,Middle,True
516507,Phys.Org,At least 21 dead in torrential Dominican Republic rains,cyclone,pro-science,gb,Middle,True
516570,Al Jazeera English,Turkey searches Black Sea for lost sailors following deadly storms,cyclone,left-center,us,Skews Left,True
516627,International Business Times,Global One-day Temperature Spikes Above 2C For First Time: EU Monitor,cyclone,left-center,us,Middle,True
516783,The Punch,"Floods displaced 650,000 Nigerian children in six years – UNICEF",cyclone,left-center,ng,,True
583489,Gizmodo.com,Why ‘Climate Havens’ Could Be Closer to Home Than You’d Think,cyclone,left,us,Skews Left,True
584314,GlobeNewswire,"Burlington Stores, Inc. Reports Third Quarter 2023 Earnings",cyclone,least biased,us,,True
619680,BBC News,Climate change: Rise in Google searches around ‘anxiety’,cyclone,left-center,gb,Middle,True
622038,Al Jazeera English,"10 years after Haiyan, are mangroves protecting Philippine coastal areas?",cyclone,left-center,us,Skews Left,True
622909,The Times of India,Fund to compensate developing nations for climate change is unfinished business at Cop28,cyclone,right-center,in,Middle,True
625288,Al Jazeera English,"Hit by floods and fires, a Greek village has lost hope",cyclone,left-center,us,Skews Left,True
644386,Phys.Org,Study shows tropical cyclones substantially raise the social cost of carbon,cyclone,pro-science,gb,Middle,True
674016,ABC News,"Sea turtle nests break records on US beaches, but global warming threatens survival",cyclone,left-center,us,Middle,True
689593,International Business Times,"Heat, Disease, Air Pollution: How Climate Change Impacts Health",cyclone,left-center,us,Middle,True
754699,Al Jazeera English,What is Africa’s goal at COP28 as the climate summit begins?,cyclone,left-center,us,Skews Left,True
754710,NPR,3 climate impacts the U.S. will see if warming goes beyond 1.5 degrees,cyclone,left-center,us,Middle,True
90234,The Indian Express,"Cyclone Hamoon to develop in Bay of Bengal today, storm headed towards Bangladesh",cyclone,left-center,in,Middle,False
90256,The Indian Express,No respite from rising AQI levels even as Cyclone Tej develops,cyclone,left-center,in,Middle,False
90458,The Times of India,Cyclone Tej to intensify into 'severe cyclonic storm' before noon today: IMD,cyclone,right-center,in,Middle,False
90545,The Punch,Gulf states pledge $100m in ‘urgent’ aid for Gaza,cyclone,left-center,ng,,False
90584,The Times of India,Cyclone 'Tej' expected to make landfall between Yemen and Oman on October 25,cyclone,right-center,in,Middle,False
91176,Forbes,Enlist New Nuclear Reactor Tech And DHS FEMA To Project Power Ashore,cyclone,right-center,us,Middle,False
93212,Phys.Org,"Hurricanes are now twice as likely to zip from minor to whopper than decades ago, study says",cyclone,pro-science,gb,Middle,False
93287,Phys.Org,Report: The US just had its seventh-warmest September on record,cyclone,pro-science,gb,Middle,False
94196,BBC News,Damage and disruption: Storm Ciarán in pictures,cyclone,left-center,gb,Middle,False
94424,NPR,"When disaster strikes, these good boys and girls are your rescue crew",cyclone,left-center,us,Middle,False
95525,Phys.Org,A monster eddy current is spinning into existence off the coast of Sydney—will it bring a new marine heat wave?,cyclone,pro-science,gb,Middle,False
98172,CNA,Dutch 'headwind cycle race' blown away by storm,cyclone,least biased,sg,Middle,False
99116,Marketscreener.com,Assurant : Q3 for Q3 2023 Financial Earnings Transcript 2023,cyclone,least biased,fr,,False
99123,Marketscreener.com,Assurant : Q3 2023 Earnings Transcript,cyclone,least biased,fr,,False
99137,Marketscreener.com,Heritage Reports Third Quarter 2023 Results,cyclone,least biased,fr,,False
100903,Marketscreener.com,Granite Continues Airfield Safety Enhancement Program at Tucson International Airport,cyclone,least biased,fr,,False
104902,NPR,Chronic drug shortages stress hospitals and patients,cyclone,left-center,us,Middle,False
104944,BBC News,"Devon: Storm Ciarán causes floods, power outages and shuts schools",cyclone,left-center,gb,Middle,False
105070,BBC News,Storm Ciarán causes rail disruption across Scotland,cyclone,left-center,gb,Middle,False
105216,Marketscreener.com,PPL Corporation reports third-quarter 2023 earnings,cyclone,least biased,fr,,False
105234,Marketscreener.com,Exelon Reports Third Quarter 2023 Results,cyclone,least biased,fr,,False
105279,Marketscreener.com,Southern Company reports third-quarter 2023 earnings,cyclone,least biased,fr,,False
105289,Marketscreener.com,IsoEnergy : 3rd Quarter Management's Discussion and Analysis 2023,cyclone,least biased,fr,,False
105307,GlobeNewswire,Targa Resources Corp. Reports Third Quarter 2023 Financial Results and Announces Expectations for a 50% Year-Over-Year Increase to 2024 Common Dividend,cyclone,least biased,us,,False
735,NPR,This expert on water scarcity would never call herself a 'genius.' But MacArthur would,cyclone,left-center,us,Middle,False
1788,Al Jazeera English,Russia pursues Avdiivka with ‘meat assaults’ in a replay of Bakhmut,cyclone,left-center,us,Skews Left,False
1912,ABC News,Early morning storms leave path of damage from Tampa Bay into north Florida,cyclone,left-center,us,Middle,False
2165,Phys.Org,Tornadoes in the UK are surprisingly common and no one knows why,cyclone,pro-science,gb,Middle,False
6797,Business Insider,How 1880s technology made it possible for 2 women to travel around the world in under 80 days,cyclone,left-center,us,Middle,False
7275,Phys.Org,Four dead as Tropical Storm Pilar dumps heavy rains on C. America,cyclone,pro-science,gb,Middle,False
11973,ABC News,Evacuations ordered as remnants of Typhoon Koinu hit southern China,cyclone,left-center,us,Middle,False
11993,ABC News,Hong Kong cancels scores of flights as Tropical Storm Koinu draws nearer,cyclone,left-center,us,Middle,False
12504,Business Insider,"Sunny days for the US economy could end abruptly if these 2 'storm clouds' hit, JPMorgan's Jamie Dimon warns",cyclone,left-center,us,Middle,False
12587,Business Insider,"Russia tried to field an elite series of 'storm' units but ended up stuffing them with convicts instead, UK intel says",cyclone,left-center,us,Middle,False
12642,Business Insider,"Russian soldiers who drink and break rules get sent to punishment battalions where they are likely to die fighting, report says",cyclone,left-center,us,Middle,False
12671,Business Insider,"Russia is promising prisoners a $31,000 payout if they get injured, soldier says. It's likelier than they realize.",cyclone,left-center,us,Middle,False
14115,ABC News,Tropical Storm Philippe chugs toward Bermuda on a path to Atlantic Canada and New England,cyclone,left-center,us,Middle,False
14120,ABC News,Tropical Storm Philippe drenches Bermuda en route to Atlantic Canada and New England,cyclone,left-center,us,Middle,False
14529,Marketscreener.com,New Zealand's Tower raises annual profit forecast on lower cyclone allowance,cyclone,least biased,fr,,False
15251,The Times of India,Cyclone 'Tej' intensifies into extremely severe cyclonic storm,cyclone,right-center,in,Middle,False
15645,Phys.Org,Study shows live plant pathogens can travel on dust across oceans,cyclone,pro-science,gb,Middle,False
16875,Time,Thousands of U.S. Workers Are on Strike. Here’s a Rundown of Major Work Stoppages,cyclone,left-center,us,Skews Left,False
16998,Al Jazeera English,Is Russia recruiting Muslim migrants to fight its war in Ukraine?,cyclone,left-center,us,Skews Left,False
18161,Boing Boing,Incredibly bizarre video of forest floor lifting off the ground like a rug,cyclone,left,us,Strong Left,False
19528,The Verge,Google Search can now help verify an image’s origins,cyclone,left-center,us,Middle,False
19748,Boing Boing,Astonishing image of Jupiter reveals never-before-seen wild weather phenomenon,cyclone,left,us,Strong Left,False
19930,Phys.Org,Royal Charter storm of 1859: How an almighty tempest led to the birth of the UK's shipping forecast,cyclone,pro-science,gb,Middle,False
19967,Business Insider,I moved from California to Texas and had to take a train to visit for the first time because I couldn't afford a flight. Now I own a home.,cyclone,left-center,us,Middle,False
20053,Forbes,Family Entertainment Centers: Tips For Generating Profits In Any Weather,cyclone,right-center,us,Middle,False
20110,ABC News,"'Miracle' water year in California: Rain, snow put reservoirs at 128% of average",cyclone,left-center,us,Middle,False
20133,Phys.Org,Storm Babet caused dangerous floods as the 'dry side' of Scotland isn't used to such torrential rain,cyclone,pro-science,gb,Middle,False
23481,ABC News,Horrors emerge from Hamas infiltration of Israel on Gaza border,cyclone,left-center,us,Middle,False
24776,Boing Boing,Albatrosses listen to the sea to navigate the sky,cyclone,left,us,Strong Left,False
27246,Time,"On AmeriCorps’ Thirtieth Anniversary, Congress Considers Gutting National Service",cyclone,left-center,us,Skews Left,False
30146,Android Central,These are the power banks I'm hoping to buy this Black Friday,cyclone,,gb,,False
32731,Business Insider,"James Webb Space Telescope discovers Jupiter has a jet stream whipping around the planet at 320 mph, twice as fast as Earth's fiercest hurricanes",cyclone,left-center,us,Middle,False
32897,Digital Trends,Researchers discover a 320-mph jet stream around Jupiter’s equator,cyclone,,us,Middle,False
33326,Deadline,‘In Restless Dreams’ Director Alex Gibney On Paul Simon’s Extraordinary Music: “It Gets In Your Lungs And Suddenly You’re Breathing It”,cyclone,left-center,us,Middle,False
39423,BBC News,Band walks 870 miles to complete Wales tour,cyclone,left-center,gb,Middle,False
50557,The Punch,"Remo, Sporting clash in southwest derby",cyclone,left-center,ng,,False
50597,The Punch,"DSS officers slapped, threatened to kill me for defending client – Lawyer",cyclone,left-center,ng,,False
51109,The Indian Express,Depression over Bay of Bengal likely to become low-intensity cyclone,cyclone,left-center,in,Middle,False
53396,CNN,How Tropical Storm Philippe could muck up weather in the Northeast this weekend,cyclone,left-center,us,Skews Left,False
53408,CNN,"Tropical Storm Philippe will deliver another wet, miserable weekend to the Northeast",cyclone,left-center,us,Skews Left,False
53464,CNN,Tropical Storm Philippe will combine with a potent cold front to soak the Northeast this weekend,cyclone,left-center,us,Skews Left,False
53566,CNN,"Rest of hurricane season in 'uncharted waters' because of El Niño, record ocean temperatures",cyclone,left-center,us,Skews Left,False
53569,ABC News,Former Tropical Storm Philippe's remnants headed to waterlogged New England and Atlantic Canada,cyclone,left-center,us,Middle,False
53721,International Business Times,100 Most Beautiful Female K-Pop Idols Of 2023,cyclone,left-center,us,Middle,False
58348,ABC News,"Lidia dissipates after killing 1, injuring 2 near Mexico resort, Atlantic sees Tropical Storm Sean",cyclone,left-center,us,Middle,False
60879,Time,"Powerful Storm Hits Northern Europe, Killing at Least 4 People",cyclone,left-center,us,Skews Left,False
60907,NPR,"Gale-force winds and floods strike northern Europe, killing at least 3 in the U.K.",cyclone,left-center,us,Middle,False
66292,BBC News,Warnings increased as Storm Babet batters England,cyclone,left-center,gb,Middle,False
68168,Phys.Org,"Researchers identify largest ever solar storm in ancient 14,300-year-old tree rings",cyclone,pro-science,gb,Middle,False
72672,Globalsecurity.org,Iran to hold naval drills in Indian Ocean: Commander,cyclone,least biased,us,,False
73480,Business Insider,"One-third of the world's captive orcas are in the US, and no one can agree on what to do with them",cyclone,left-center,us,Middle,False
78435,International Business Times,Libya Flood Relief Hampered By 'Turf Wars' And Division,cyclone,left-center,us,Middle,False
78436,International Business Times,'Broken In Two': Libya Flood Survivors Grapple With Mental Health,cyclone,left-center,us,Middle,False
78605,BBC News,Libya floods: The flawed response that increased Derna death toll,cyclone,left-center,gb,Middle,False
78693,The Times of India,'Broken in two': Libya flood survivors grapple with mental health,cyclone,right-center,in,Middle,False
115739,BBC News,Storm Ciarán: Floods ravage Tuscany leaving three dead,cyclone,left-center,gb,Middle,False
